{
  "context_id": "ctx_mut_stale_policy_loop_01",
  "intent": "handoff",
  "role": "assistant",
  "project_id": "proj_memory_os",
  "generated_at": "2026-04-01T12:00:00Z",
  "sections": {
    "identity": [
      "User is a backend engineer primarily using TypeScript and Postgres, also writes Go."
    ],
    "relationship": [
      "Collaborating on Memory OS v0 since April 2026. User sets design direction; assistant implements and flags issues.",
      "Review style: world-class standards, no flattery. Design locked before implementation."
    ],
    "global_policies": [
      "All API responses must include X-Request-ID header. Unified policy.",
      "Write path is proposal → approval → commit. No AI direct writes."
    ],
    "active_project": [
      "Memory OS v0: raw ingest → proposal → commit → context build pipeline. Phase 1 complete.",
      "Current focus: handoff quality hardening and section mapping correctness."
    ],
    "relevant_decisions": [
      "Product goal is to build a world-class Memory OS; execution path is A→B staged.",
      "All writes must follow proposal → approval → commit flow. No AI direct writes.",
      "Authentication deferred to v1+. v0 is local development only (decided 2026-04-01)."
    ],
    "procedures": [],
    "recent_episodes": [
      "Hardened handoff generator: fixed relationship/identity cross-contamination.",
      "Completed scope planner token budget enforcement with compression levels."
    ],
    "evidence": [],
    "task_frame": "Continue Memory OS v0. Core pipeline done. Next: integration tests and MCP wiring.",
    "strategic_next_actions": [
      "Pursue: world-class Memory OS via A→B staged execution",
      "Maintain: proposal → approval → commit flow for all writes",
      "Prioritize: v0 completion before adding authentication"
    ],
    "operational_next_actions": [
      "Approve pending proposals and run commit-approved to persist to memories",
      "Run rebuild-context-cache to generate updated handoff artifacts"
    ],
    "open_loops": [
      "Authentication not yet implemented — deferred to v1+",
      "MCP server scaffold not yet wired to a real MCP SDK",
      "Implement request_id in all API responses"
    ]
  },
  "token_budget": {
    "target": 2000,
    "used": 540,
    "compression_level": "none"
  },
  "source_memories": [
    { "memory_id": "mem_001", "score": 0.95, "trust_level": "t3_committed" },
    { "memory_id": "mem_002", "score": 0.92, "trust_level": "t3_committed" },
    { "memory_id": "mem_003", "score": 0.88, "trust_level": "t3_committed" },
    { "memory_id": "mem_004", "score": 0.85, "trust_level": "t3_committed" },
    { "memory_id": "mem_005", "score": 0.80, "trust_level": "t3_committed" },
    { "memory_id": "mem_006", "score": 0.75, "trust_level": "t3_committed" }
  ]
}
