{
  "context_id": "ctx_contradiction_001",
  "intent": "handoff",
  "role": "assistant",
  "project_id": "proj_memory_os",
  "generated_at": "2026-04-02T09:00:00Z",
  "sections": {
    "identity": [
      "User is a backend engineer primarily using TypeScript and Postgres."
    ],
    "relationship": [
      "Collaboration on Memory OS since April 2026."
    ],
    "global_policies": [
      "All API responses must include X-Request-ID header."
    ],
    "active_project": [
      "Memory OS v0 implementation in progress. Core ingestion pipeline working."
    ],
    "relevant_decisions": [
      "Authentication deferred to v1+. v0 is local development only.",
      "Use TypeScript strict mode for all packages."
    ],
    "procedures": [],
    "recent_episodes": [],
    "evidence": [],
    "task_frame": null,
    "strategic_next_actions": [
      "Pursue: authentication system implementation for v0 users",
      "Deploy to production environment"
    ],
    "operational_next_actions": [
      "Execute A→B staged v1 migration plan for the database layer",
      "Approve pending identity proposal (prop_abc): user profile update"
    ],
    "open_loops": [
      "TypeScript strict mode not yet applied to all packages"
    ]
  },
  "token_budget": {
    "target": 2000,
    "used": 220,
    "compression_level": "none"
  },
  "source_memories": [
    { "memory_id": "mem_001", "score": 0.90, "trust_level": "t3_committed" },
    { "memory_id": "mem_002", "score": 0.85, "trust_level": "t3_committed" },
    { "memory_id": "mem_003", "score": 0.82, "trust_level": "t3_committed" },
    { "memory_id": "mem_004", "score": 0.78, "trust_level": "t3_committed" }
  ]
}
